{"created_at":"2026-10-10T03:05:27.641625Z","id":"lane_1d84fb8818b64e338eec2c14e97aa61c","kind":"lane","parents":[],"schema":"urn:factum:core:lane:1","tags":{"docs_path":"data/lanes/2026-09-28-chinese-amap-fleet","grade":"OBSERVED","lane":"2026-09-28-chinese-amap-fleet","legacy_path":"evidence/remove-2026-09-28-chinese-amap-fleet"},"title":"2026-09-28-chinese-amap-fleet: Chinese Amap agent fleet urlquery sweep"}
